"launch_name","location_name","location_location","rockets_launched"
Maiden Flight,Launch Pad 3C,Pacific Spaceport Complex - Alaska - USA,Pacific Spaceport Complex, Alaska, USA,
Eutelsat 10B,Space Launch Complex 40,Cape Canaveral - FL - USA,Cape Canaveral, FL, USA,
Dragon CRS-2 SpX-26,Launch Complex 39A,Kennedy Space Center - FL - USA,Kennedy Space Center, FL, USA,
Yaogan 36 Group 03 (?),Launch Complex 3 ( LC-3 ) ( LA-1 ),Xichang Satellite Launch Center - People’s Republic of China,Xichang Satellite Launch Center, People’s Republic of China,
Pléiades Neo 5 & 6,Ariane Launch Area 1,Kourou - French Guiana,Kourou, French Guiana,
EOS-6 (Oceansat-3),Satish Dhawan Space Centre First Launch Pad,Sriharikota - Republic of India,Sriharikota, Republic of India,
Glonass-M No. 61,43/3 (43L),Plesetsk Cosmodrome - Russian Federation,Plesetsk Cosmodrome, Russian Federation,
Hakuto-R M1 & Lunar Flashlight,Space Launch Complex 40,Cape Canaveral - FL - USA,Cape Canaveral, FL, USA,
OneWeb 15,Launch Complex 39A,Kennedy Space Center - FL - USA,Kennedy Space Center, FL, USA,
Starlink Group 2-4,Space Launch Complex 4E,Vandenberg SFB - CA - USA,Vandenberg SFB, CA, USA,
Shenzhou 15,Launch Area 4 (SLS-1 / 921),Jiuquan - People’s Republic of China,Jiuquan, People’s Republic of China,
Maiden Flight,Launch Complex 16,Cape Canaveral - FL - USA,Cape Canaveral, FL, USA,
Amber-1,Spaceport Cornwall,Air launch to orbit,Air launch to orbit,
Maiden Flight,Unknown Pad,Jiuquan - People’s Republic of China,Jiuquan, People’s Republic of China,
Virginia is for Launch Lovers,Rocket Lab Launch Complex 2,Wallops Island - Virginia - USA,Wallops Island, Virginia, USA,
